{
  "schema_version": "1.0.0",
  "updated": "2026-09-19",
  "notes": "Warm quiet luxury refresh: six independent 2K Higgsfield generations, twelve marketing slots. Nano Banana Pro requested; provider reports nano_banana_2. Coach portraits preserved. Local mock delivery only; existing storage URLs remain intended handoff destinations, not updated uploads.",
  "assets": [
    {
      "id": "landing-a",
      "page": "landing",
      "slot": "hero-accent",
      "slot_letter": "A",
      "aspect_ratio": "16:9",
      "source_prompt_key": "landing-A",
      "identity_bound": false,
      "source_free": true,
      "source_asset_id": null,
      "generation_policy": "generate",
      "do_not_generate_reason": null,
      "model": "nano_banana_2",
      "model_parameters": {
        "requested_model": "nano_banana_pro",
        "reported_model": "nano_banana_2",
        "resolution": "2k",
        "aspect_ratio": "16:9",
        "generation_job_id": "0570b4f4-eaea-4e2e-83ca-2e9bb0e0529d",
        "source_kind": "source_free_non_identity"
      },
      "generation_date": "2026-09-19",
      "approval_status": "approved",
      "approver": "Codex visual QA for user-authorized marketing refresh, 2026-09-19",
      "alt_text": "Sunlit ivory movement studio with an oak floor, linen curtains, and a rolled mat.",
      "post_processing": [
        {
          "op": "standalone-generation",
          "notes": "Requested Nano Banana Pro 2K through Higgsfield MCP. Provider reports nano_banana_2. Job 0570b4f4-eaea-4e2e-83ca-2e9bb0e0529d. Full-resolution master: docs/assets/marketing/masters/quiet-luxury-studio-2k.webp. Illustrative imagery; not a photograph of the real premises."
        },
        {
          "op": "webready",
          "notes": "1600px responsive delivery; WebP q84, JPEG q87, 480px thumbnails. No contact sheets or upscaling."
        }
      ],
      "storage_key": "marketing-assets/landing/hero-accent-16x9.webp",
      "coach_slug": null,
      "working_path": "docs/assets/marketing/landing/hero-accent-16x9.webp",
      "public_url": "https://xydundrayuusqizssgby.supabase.co/storage/v1/object/public/marketing-assets/landing/hero-accent-16x9.webp",
      "storage_objects": [
        {
          "working_path": "docs/assets/marketing/landing/hero-accent-16x9.webp",
          "storage_key": "marketing-assets/landing/hero-accent-16x9.webp",
          "public_url": "https://xydundrayuusqizssgby.supabase.co/storage/v1/object/public/marketing-assets/landing/hero-accent-16x9.webp"
        },
        {
          "working_path": "docs/assets/marketing/landing/hero-accent-16x9.jpg",
          "storage_key": "marketing-assets/landing/hero-accent-16x9.jpg",
          "public_url": "https://xydundrayuusqizssgby.supabase.co/storage/v1/object/public/marketing-assets/landing/hero-accent-16x9.jpg"
        }
      ]
    },
    {
      "id": "landing-b",
      "page": "landing",
      "slot": "classes-editorial",
      "slot_letter": "B",
      "aspect_ratio": "3:2",
      "source_prompt_key": "landing-B",
      "identity_bound": false,
      "source_free": true,
      "source_asset_id": null,
      "generation_policy": "generate",
      "do_not_generate_reason": null,
      "model": "nano_banana_2",
      "model_parameters": {
        "requested_model": "nano_banana_pro",
        "reported_model": "nano_banana_2",
        "resolution": "2k",
        "aspect_ratio": "3:2",
        "generation_job_id": "990e0a80-a820-4aa2-82ae-9082bb715f9c",
        "source_kind": "source_free_non_identity"
      },
      "generation_date": "2026-09-19",
      "approval_status": "approved",
      "approver": "Codex visual QA for user-authorized marketing refresh, 2026-09-19",
      "alt_text": "Small group practicing grounded yoga stretches in a softly lit studio.",
      "post_processing": [
        {
          "op": "standalone-generation",
          "notes": "Requested Nano Banana Pro 2K through Higgsfield MCP. Provider reports nano_banana_2. Job 990e0a80-a820-4aa2-82ae-9082bb715f9c. Full-resolution master: docs/assets/marketing/masters/quiet-luxury-movement-2k.webp. Illustrative imagery; not a photograph of the real premises."
        },
        {
          "op": "webready",
          "notes": "1600px responsive delivery; WebP q84, JPEG q87, 480px thumbnails. No contact sheets or upscaling."
        }
      ],
      "storage_key": "marketing-assets/landing/classes-editorial-3x2.webp",
      "coach_slug": null,
      "working_path": "docs/assets/marketing/landing/classes-editorial-3x2.webp",
      "public_url": "https://xydundrayuusqizssgby.supabase.co/storage/v1/object/public/marketing-assets/landing/classes-editorial-3x2.webp",
      "storage_objects": [
        {
          "working_path": "docs/assets/marketing/landing/classes-editorial-3x2.webp",
          "storage_key": "marketing-assets/landing/classes-editorial-3x2.webp",
          "public_url": "https://xydundrayuusqizssgby.supabase.co/storage/v1/object/public/marketing-assets/landing/classes-editorial-3x2.webp"
        },
        {
          "working_path": "docs/assets/marketing/landing/classes-editorial-3x2.jpg",
          "storage_key": "marketing-assets/landing/classes-editorial-3x2.jpg",
          "public_url": "https://xydundrayuusqizssgby.supabase.co/storage/v1/object/public/marketing-assets/landing/classes-editorial-3x2.jpg"
        }
      ]
    },
    {
      "id": "landing-c",
      "page": "landing",
      "slot": "how-it-works-still-life",
      "slot_letter": "C",
      "aspect_ratio": "1:1",
      "source_prompt_key": "landing-C",
      "identity_bound": false,
      "source_free": true,
      "source_asset_id": null,
      "generation_policy": "generate",
      "do_not_generate_reason": null,
      "model": "nano_banana_2",
      "model_parameters": {
        "requested_model": "nano_banana_pro",
        "reported_model": "nano_banana_2",
        "resolution": "2k",
        "aspect_ratio": "1:1",
        "generation_job_id": "1e088f5a-0258-47e3-9a4a-ae48373ce75e",
        "source_kind": "source_free_non_identity"
      },
      "generation_date": "2026-09-19",
      "approval_status": "approved",
      "approver": "Codex visual QA for user-authorized marketing refresh, 2026-09-19",
      "alt_text": "Folded cotton towel, water bottle, boxing wraps, and yoga strap on an oak bench.",
      "post_processing": [
        {
          "op": "standalone-generation",
          "notes": "Requested Nano Banana Pro 2K through Higgsfield MCP. Provider reports nano_banana_2. Job 1e088f5a-0258-47e3-9a4a-ae48373ce75e. Full-resolution master: docs/assets/marketing/masters/quiet-luxury-ritual-2k.webp. Illustrative imagery; not a photograph of the real premises."
        },
        {
          "op": "webready",
          "notes": "1600px responsive delivery; WebP q84, JPEG q87, 480px thumbnails. No contact sheets or upscaling."
        }
      ],
      "storage_key": "marketing-assets/landing/how-it-works-still-life-1x1.webp",
      "coach_slug": null,
      "working_path": "docs/assets/marketing/landing/how-it-works-still-life-1x1.webp",
      "public_url": "https://xydundrayuusqizssgby.supabase.co/storage/v1/object/public/marketing-assets/landing/how-it-works-still-life-1x1.webp",
      "storage_objects": [
        {
          "working_path": "docs/assets/marketing/landing/how-it-works-still-life-1x1.webp",
          "storage_key": "marketing-assets/landing/how-it-works-still-life-1x1.webp",
          "public_url": "https://xydundrayuusqizssgby.supabase.co/storage/v1/object/public/marketing-assets/landing/how-it-works-still-life-1x1.webp"
        },
        {
          "working_path": "docs/assets/marketing/landing/how-it-works-still-life-1x1.jpg",
          "storage_key": "marketing-assets/landing/how-it-works-still-life-1x1.jpg",
          "public_url": "https://xydundrayuusqizssgby.supabase.co/storage/v1/object/public/marketing-assets/landing/how-it-works-still-life-1x1.jpg"
        }
      ]
    },
    {
      "id": "landing-d",
      "page": "landing",
      "slot": "final-cta",
      "slot_letter": "D",
      "aspect_ratio": "21:9",
      "source_prompt_key": "landing-D",
      "identity_bound": false,
      "source_free": true,
      "source_asset_id": null,
      "generation_policy": "generate",
      "do_not_generate_reason": null,
      "model": "nano_banana_2",
      "model_parameters": {
        "requested_model": "nano_banana_pro",
        "reported_model": "nano_banana_2",
        "resolution": "2k",
        "aspect_ratio": "21:9",
        "generation_job_id": "c37f5b76-62b1-48b1-82e1-587b8dd39af7",
        "source_kind": "source_free_non_identity"
      },
      "generation_date": "2026-09-19",
      "approval_status": "approved",
      "approver": "Codex visual QA for user-authorized marketing refresh, 2026-09-19",
      "alt_text": "Two people unwinding after class in a warm, light-filled movement studio.",
      "post_processing": [
        {
          "op": "standalone-generation",
          "notes": "Requested Nano Banana Pro 2K through Higgsfield MCP. Provider reports nano_banana_2. Job c37f5b76-62b1-48b1-82e1-587b8dd39af7. Full-resolution master: docs/assets/marketing/masters/quiet-luxury-evening-2k.webp. Illustrative imagery; not a photograph of the real premises."
        },
        {
          "op": "webready",
          "notes": "1600px responsive delivery; WebP q84, JPEG q87, 480px thumbnails. No contact sheets or upscaling."
        }
      ],
      "storage_key": "marketing-assets/landing/final-cta-21x9.webp",
      "coach_slug": null,
      "working_path": "docs/assets/marketing/landing/final-cta-21x9.webp",
      "public_url": "https://xydundrayuusqizssgby.supabase.co/storage/v1/object/public/marketing-assets/landing/final-cta-21x9.webp",
      "storage_objects": [
        {
          "working_path": "docs/assets/marketing/landing/final-cta-21x9.webp",
          "storage_key": "marketing-assets/landing/final-cta-21x9.webp",